id;namaAsuransi;nomorRekanan;alamat;pic;contact;fax;email;jatuhTempo;keterangan;id_status;id_sanksi;dateCreateAj;dateUpdateAj;dateDeleteAj
1;PT. Asuransi Jiwa Sequis Life;As.Jiwa / S-01;Sequis Center Lt. 6, Jl. Jend. Sudirman No. 71 Jakarta 12190 ;Aman Johanes;021-5223123/22, 0816923289;021-5213579/80;aman.johanes@sequislife.com;2020-02-28;;2;2;2020-03-31;;
2;PT. BNI Life Insurance      ;As.Jiwa / B-01;Centenial Tower Lt.9 Jl. Gatot Subroto Kav.24-25 Jakarta 12930;Tamara Prasetya;021-29539999 / 081295450650;021-29539998;tamara.prastya@bni-life.co.id ;2021-03-31;;1;1;2020-03-31;;
3;PT. Asuransi CIGNA;As.Jiwa / C-01;Gedung Tempo Pavilion 2 Lt. 9 Jl. H.R. Rasuna Said Kav. 10 Jakarta Selatan;Fifi, Fahmi Windiarto;Fifi 021-52996000 / 08121057217, Fahmi Windiarto 08121057217;021-52996001;rizka.fitrikatili@cigna.com, fahmi.windiarto@cigna.com;2020-05-31;Terbatas Untuk Bisnis Kartu dan Konsumer;4;1;2020-03-31;;
4;PT. Equity Life Indonesia;As.Jiwa / E-01;Wisma Sudirman Lt. 1 & Lt. 3A Jl. Jend. Sudirman Kav. 34 Jakarta-10220;Shinta Natalia, Delyawati;Shinta Natalia 021-5739288 / 0818927180, Delyawati 0817706620;021-5700672;shinta.natalia@equity.id, delyawati@equity.id;2021-01-31;;1;1;2020-03-31;;
5;PT. Asuransi Jiwasraya;As.Jiwa / J-01;Jl. Ir H Juanda No.34  Kebon Kelapa Gambir Jakarta Pusat - 10120;Syari Fitriani;021-3845031, 3865170, 3865208 / 082219283490;021-3862344;syari.fitriani@jiwasraya.co.id;2020-06-30;;1;4;2020-03-31;;
6;PT. Sun Life Financial Indonesia;As.Jiwa / S-02;World Trade Center Lt. 8 & Lt. 9 Jl. Jenderal Sudirman Kav. 29-31 Jakarta-12920;Alfa Anastasia;021-52890000, 29942888 / 081807232121;021-52890019;alfa.anastasia@sunlife.com;2019-11-30;;3;5;2020-03-31;;
7;PT. AIA Financial;As.Jiwa /A-01;Gd AIA Central Jl. Jend Sudirman Kav.48A, Jakarta;Rita;021-54218888 / 0811817199  ;021-5475409;galuh.elrita@aia.com;2018-12-31;;3;5;2020-03-31;;
